body,author
"A reader lives a thousand lives before he dies. The man who never reads lives only one.","George R.R. Martin"
"Books are a uniquely portable magic.","Stephen King"
"There is no greater agony than bearing an untold story inside you.","Maya Angelou"
"The person, be it gentleman or lady, who has not pleasure in a good novel, must be intolerably stupid.","Jane Austen"
"So many books, so little time.","Frank Zappa"
"A room without books is like a body without a soul.","Marcus Tullius Cicero"